{
  "schemaVersion": 2,
  "id": "star",
  "title": "Star",
  "canvas": { "width": 1000, "height": 1000 },
  "steps": [
    {
      "id": "point-top",
      "title": "Draw the top point",
      "instruction": "First the top point. Go up to the tip and straight back down the other side.",
      "voiceover": null,
      "strokes": [
        {
          "d": "M 385.317 361.4805 C 385.5507 361.3263 385.7784 361.1662 386 361 C 390 358 392 354 395 348 C 410 314 461 192 476 159 C 479 153 483 149 487 146 C 491 143 496 142 501 142 C 505 142 510 144 514 146 C 517 149 520 152 523 158 C 538 191 588 311 602 343 C 604 348 606 352 608 355 C 609.6934 357.5401 610.6699 359.3633 612.7505 360.4696",
          "duration": 2.5,
          "lineWidth": 14
        }
      ]
    },
    {
      "id": "point-right",
      "title": "Draw the right point",
      "instruction": "Next, the point reaching out to the right. Same shape, lying on its side.",
      "voiceover": null,
      "strokes": [
        {
          "d": "M 612.7505 360.4696 C 613.1272 360.6699 613.5401 360.8467 614 361 C 618 363 624 365 632 366 C 669 369 800 379 837 382 C 844 383 850 385 854 388 C 858 390 860 394 862 398 C 863 402 863 408 862 413 C 861 418 858 422 854 426 C 826 450 723 535 695 559 C 692 562 689 565 687 567 C 685 570 684 571 683 574",
          "duration": 2.6,
          "lineWidth": 14
        }
      ]
    },
    {
      "id": "point-lower-right",
      "title": "Draw the right leg",
      "instruction": "Now down to the leg on the right. Out to its tip, then back up.",
      "voiceover": null,
      "strokes": [
        {
          "d": "M 683 574 C 683 577 682 580 683 584 C 683 587 684 591 685 596 C 694 630 728 752 737 786 C 738 790 739 793 739 796 C 739 800 739 802 738 805 C 737 808 735 812 732 814 C 730 816 727 818 724 819 C 721 820 718 820 715 820 C 711 820 708 819 704 817 C 671 799 551 728 519 710 C 515 707 511 706 508 704 C 505.7143 703.2381 504.0091 703.0567 501.9998 703.0135",
          "duration": 2.6,
          "lineWidth": 14
        }
      ]
    },
    {
      "id": "point-lower-left",
      "title": "Draw the left leg",
      "instruction": "The left leg is a mirror of it. Out to the tip, then back.",
      "voiceover": null,
      "strokes": [
        {
          "d": "M 501.9998 703.0135 C 501.3719 703 500.7143 703 500 703 C 496 704 490 705 484 708 C 451 727 331 797 298 816 C 294 818 290 819 286 820 C 282 820 278 820 275 819 C 272 818 270 816 267 814 C 265 812 264 810 263 807 C 262 804 261 801 261 797 C 261 794 261 790 262 786 C 271 752 306 627 315 594 C 316 589 317 586 317 583 C 317 580.4636 317 578.7314 316.745 577.0384",
          "duration": 2.6,
          "lineWidth": 14
        }
      ]
    },
    {
      "id": "point-left",
      "title": "Draw the left point",
      "instruction": "Last, the point reaching left. Close the star where you began.",
      "voiceover": null,
      "strokes": [
        {
          "d": "M 316.745 577.0384 C 316.5979 576.0615 316.3659 575.0977 316 574 C 314 571 311 566 306 561 C 277 537 173 450 145 426 C 141 422 139 418 138 414 C 137 409 137 403 138 399 C 139 395 142 391 146 389 C 151 386 156 384 164 383 C 201 379 332 370 369 366 C 375.6122 365.0554 381.3321 364.1108 385.317 361.4805",
          "duration": 2.6,
          "lineWidth": 14
        }
      ]
    },
    {
      "id": "star",
      "title": "Color the star",
      "instruction": "Color the star yellow.",
      "voiceover": null,
      "strokes": [],
      "fills": [
        {
          "d": "M 494 134 C 499 131 504 135 509 135 C 516 142 525 146 530 157 C 548 194 586 290 614 356 C 618 357 620 359 625 359 C 643 361 690 363 722 365 C 722 366 722 367 723 367 C 725 367 732 366 734 366 C 735 366 735 369 736 369 C 738 369 744 367 746 367 C 747 367 746 369 747 369 C 749 369 753 368 757 368 C 773 369 828 373 844 375 C 847 375 849 376 851 378 C 855 382 867 393 870 397 C 871 399 872 400 872 402 C 872 405 872 411 869 416 C 865 422 856 430 847 438 C 817 463 717 545 691 568 C 689 570 689 571 689 574 C 689 578 688 584 690 590 C 700 627 738 759 748 794 C 749 797 749 800 748 802 C 748 804 747 806 745 808 C 741 812 730 824 726 827 C 724 828 723 829 721 829 C 719 829 717 830 714 829 C 711 828 707 826 703 824 C 673 806 564 742 532 723 C 524 718 517 714 512 712 C 508 710 506 709 502 709 C 497 709 491 710 484 714 C 448 734 353 791 287 829 C 283 828 278 828 274 827 C 267 819 260 812 253 804 C 253 800 252 796 253 791 C 254 786 255 781 257 774 C 267 740 302 619 311 585 C 312 580 310 576 310 571 C 259 528 186 467 156 441 C 145 432 136 421 131 416 C 129 414 128 413 128 411 C 128 409 129 404 129 401 C 136 394 146 383 150 379 C 152 377 153 376 156 376 C 193 373 332 363 370 360 C 376 360 379 358 384 357 C 412 292 452 197 467 163 C 469 159 469 157 472 154 C 477 149 488 137 494 134 Z",
          "color": "#F7CF46",
          "duration": 3,
          "fillRule": "evenodd"
        }
      ]
    }
  ]
}
