{
  "schemaVersion": 2,
  "id": "sphere",
  "title": "Sphere",
  "canvas": { "width": 1000, "height": 1000 },
  "steps": [
    {
      "id": "ball-left",
      "title": "Draw the left side",
      "instruction": "The ball starts as a big circle. From the top, swing around the left side to where it rests.",
      "voiceover": null,
      "strokes": [
        {
          "d": "M 402.0024 237.7406 C 386.4827 237.6989 368.3168 239.5031 355 242 C 338 245 320 252 309 256 C 299 259 292 263 285 266 C 277 270 270 274 262 279 C 254 284 244 291 238 296 C 231 301 228 304 222 310 C 215 317 203 329 193 342 C 184 355 173 372 167 387 C 160 401 155 413 151 429 C 148 444 145 466 144 478 C 143 487 143 492 144 501 C 144 509 146 519 147 528 C 149 536 150 543 152 551 C 155 558 157 565 161 574 C 166 586 175 606 182 617 C 188 628 194 635 199 642 C 205 649 210 655 216 661 C 222 667 228 673 235 679 C 241 684 246 688 255 693 C 265 699 281 709 295 715 C 308 721 321 725 336 729 C 350 732 366 734 382 735 C 390.472 735.5648 398.625 736.1296 406.9995 736.1539",
          "duration": 2.04,
          "lineWidth": 4
        }
      ]
    },
    {
      "id": "ball-right",
      "title": "Draw the right side",
      "instruction": "From the top again, swing around the right side and close the ball.",
      "voiceover": null,
      "strokes": [
        {
          "d": "M 402.0024 237.7406 C 405.1295 237.749 408.1491 237.8323 411 238 C 427 238 441 240 456 243 C 470 247 485 252 499 258 C 514 265 530 274 544 283 C 557 293 571 307 579 315 C 586 322 590 327 595 334 C 601 341 606 348 611 359 C 617 370 627 389 632 404 C 637 418 641 436 643 449 C 645 460 646 468 646 477 C 647 485 647 493 646 502 C 646 510 645 517 643 526 C 642 534 640 543 637 554 C 633 565 625 586 620 597 C 615 608 611 614 605 622 C 600 631 596 637 588 646 C 580 655 566 670 558 677 C 553 682 550 684 544 688 C 537 693 526 700 515 706 C 504 712 491 718 476 723 C 462 728 442 732 427 735 C 420.0368 735.8704 413.4524 736.1726 406.9995 736.1539",
          "duration": 1.96,
          "lineWidth": 4
        }
      ]
    },
    {
      "id": "hatch-top",
      "title": "Draw the dark side",
      "instruction": "Light can't reach the lower right. Draw three slanted lines there, side by side.",
      "voiceover": null,
      "strokes": [
        {
          "d": "M 612 488 L 580 515",
          "duration": 0.4,
          "lineWidth": 4
        },
        {
          "d": "M 617 516 C 607 523 575 549 558 563 C 540 576 518 589 511 595",
          "duration": 0.7,
          "lineWidth": 4
        },
        {
          "d": "M 622 546 C 609 555 567 588 548 602 C 533 614 520 621 508 629 C 495 637 478 646 473 650",
          "duration": 0.9,
          "lineWidth": 4
        }
      ]
    },
    {
      "id": "hatch-bottom",
      "title": "Add two more lines",
      "instruction": "Add two more slanted lines below them. That's the ball's dark side.",
      "voiceover": null,
      "strokes": [
        {
          "d": "M 602 594 C 595 598 576 614 564 623 C 552 632 543 638 530 647 C 516 655 500 665 485 674 C 470 682 446 694 439 698",
          "duration": 1,
          "lineWidth": 4
        },
        {
          "d": "M 571 648 C 562 653 535 673 519 683 C 503 693 482 703 475 708",
          "duration": 0.6,
          "lineWidth": 4
        }
      ]
    },
    {
      "id": "shadow",
      "title": "Draw the shadow",
      "instruction": "The ball blocks the light, so a shadow falls to the right. Draw a long flat oval from under the ball.",
      "voiceover": null,
      "strokes": [
        {
          "d": "M 569.1221 670.3026 C 570.3474 669.8016 571.6365 669.3636 573 669 C 589 664 620 667 638 667 C 655 666 663 666 681 667 C 699 667 729 669 750 671 C 770 673 786 675 801 677 C 817 680 835 686 844 688 C 848 690 851 692 853 694 C 856 697 859 700 860 703 C 860 705 856 707 854 709 C 851 711 849 713 845 715 C 838 717 827 722 815 725 C 804 728 791 731 775 733 C 758 736 738 739 716 741 C 693 743 671 745 641 746 C 610 747 560 748 530 747 C 500 747 471 745 457 745 C 452 744 448 744 445 743 C 441 742 436 741 436 740 C 435.6375 739.275 436.0634 738.55 436.8967 737.8726",
          "duration": 3.32,
          "lineWidth": 5
        }
      ]
    },
    {
      "id": "color-ball",
      "title": "Color the ball",
      "instruction": "Color the ball orange.",
      "voiceover": null,
      "strokes": [],
      "fills": [
        {
          "d": "M 400 238 C 416 238 430 238 445 241 C 461 244 478 249 493 255 C 508 261 525 271 537 278 C 549 286 555 291 565 300 C 575 309 586 320 596 334 C 606 348 617 368 624 382 C 631 395 634 407 637 417 C 640 427 641 433 643 442 C 645 452 647 461 647 474 C 647 487 647 505 645 521 C 643 537 638 553 633 568 C 628 583 621 597 613 611 C 605 625 595 639 585 651 C 575 663 563 675 551 684 C 539 693 528 700 515 707 C 502 714 488 720 473 725 C 458 730 442 735 423 736 C 404 738 377 736 359 734 C 341 732 331 729 316 724 C 301 719 283 711 269 703 C 255 696 245 688 234 679 C 223 670 213 660 203 648 C 193 636 183 620 176 609 C 170 600 168 594 164 584 C 160 574 155 564 152 551 C 149 538 145 520 144 504 C 143 488 144 470 146 454 C 148 438 152 422 157 408 C 162 394 169 380 175 369 C 181 358 188 349 193 341 C 198 333 202 330 208 323 C 215 316 226 305 233 299 C 240 293 244 290 252 285 C 262 279 279 268 295 261 C 311 254 332 247 349 243 C 367 239 384 238 400 238 Z",
          "color": "#F08A2C",
          "duration": 3,
          "fillRule": "evenodd"
        }
      ]
    },
    {
      "id": "color-shadow",
      "title": "Color the shadow",
      "instruction": "Color the shadow gray.",
      "voiceover": null,
      "strokes": [],
      "fills": [
        {
          "d": "M 579 663 C 580 664 581 665 582 665 C 601 665 656 663 690 664 C 724 665 762 669 785 672 C 802 674 817 678 827 680 C 836 682 842 684 848 687 C 854 690 859 693 861 696 C 863 699 864 702 862 705 C 860 708 856 713 850 716 C 843 720 830 725 817 728 C 804 732 791 734 773 737 C 755 740 736 743 711 745 C 686 747 659 749 624 750 C 589 751 530 751 498 750 C 472 749 455 747 434 745 C 434 743 433 740 434 738 C 435 736 437 736 440 735 C 447 733 465 730 478 726 C 491 722 506 715 517 709 C 528 704 533 700 543 693 C 553 685 567 673 579 663 Z",
          "color": "#C9CED6",
          "duration": 1.7,
          "fillRule": "evenodd"
        }
      ]
    }
  ]
}
