{
  "schemaVersion": 2,
  "id": "apple",
  "title": "Apple",
  "canvas": { "width": 1000, "height": 1000 },
  "steps": [
    {
      "id": "left-side",
      "title": "Draw the left side",
      "instruction": "Start at the top. Draw a big letter C down to the bottom.",
      "voiceover": null,
      "strokes": [
        {
          "d": "M 495.3775 347.1926 C 490.1195 347.6668 490.4894 345.9149 485 345 C 479 343 472 341 463 337 C 453 332 437 321 428 316 C 420 312 417 311 411 309 C 405 307 399 305 391 304 C 384 303 376 302 368 303 C 359 303 347 304 338 305 C 328 307 322 308 312 311 C 303 314 291 319 282 324 C 272 328 266 332 258 338 C 250 343 243 349 235 356 C 228 363 219 373 213 381 C 206 390 202 397 197 406 C 193 414 188 422 185 433 C 181 443 177 456 175 468 C 172 479 171 493 170 503 C 169 512 169 517 170 527 C 170 536 171 551 173 562 C 175 574 178 585 181 597 C 184 609 188 623 192 634 C 196 646 199 654 205 666 C 210 678 219 696 225 707 C 231 717 233 721 240 731 C 246 742 257 757 266 769 C 276 780 288 793 296 801 C 304 809 308 811 315 816 C 321 821 330 827 336 831 C 343 835 348 837 354 840 C 360 843 367 845 374 847 C 380 849 387 851 396 852 C 404 853 409 854 423 852 C 438 850 466 843 480 840 C 488.2306 838.8242 493.3506 838.3397 498.0014 838.3432",
          "duration": 1.99,
          "lineWidth": 11
        }
      ]
    },
    {
      "id": "right-side",
      "title": "Draw the right side",
      "instruction": "Go back to the top. Draw the same curve the other way, like a mirror.",
      "voiceover": null,
      "strokes": [
        {
          "d": "M 495.3775 347.1926 C 495.8665 347.1485 496.4043 347.0851 497 347 C 505 346 517 345 531 340 C 544 335 565 323 578 317 C 592 312 599 310 610 308 C 621 306 632 305 643 306 C 655 306 665 307 677 310 C 689 313 703 318 715 323 C 727 329 739 336 749 344 C 758 352 766 359 774 369 C 782 379 791 393 796 403 C 802 413 805 421 808 429 C 812 437 814 443 816 451 C 818 459 820 469 822 477 C 823 484 824 489 824 499 C 825 508 826 521 825 532 C 825 542 824 554 823 564 C 821 575 820 584 817 597 C 814 609 809 627 805 638 C 801 650 798 657 793 667 C 789 678 783 689 778 699 C 773 709 768 717 761 726 C 755 736 745 749 738 758 C 731 766 728 770 721 777 C 713 785 704 794 695 801 C 687 808 680 814 672 820 C 664 825 657 830 647 835 C 638 839 626 845 616 848 C 607 850 599 852 590 852 C 582 853 578 853 568 852 C 557 850 540 844 529 842 C 519 839 516 839 508 839 C 504.2911 838.5879 501.2615 838.3456 498.0014 838.3432",
          "duration": 2.01,
          "lineWidth": 11
        }
      ]
    },
    {
      "id": "stem",
      "title": "Draw the stem",
      "instruction": "Start in the dip. Go up, over the top, and back down.",
      "voiceover": null,
      "strokes": [
        {
          "d": "M 478 341 C 477 334 476 317 476 303 C 475 290 475 271 476 258 C 477 244 480 232 482 222 C 485 211 488 201 490 195 C 493 189 494 190 496 188 C 498 186 499 185 502 185 C 504 184 507 184 510 184 C 513 185 517 185 521 187 C 525 190 532 193 536 197 C 539 202 540 212 541 216 L 541.3403 217.2992 C 540.9069 217.7918 540.462 218.3532 540 219 C 534 226 527 239 523 247 C 520.3096 254.1744 516.0107 259.7403 518.7583 265.1402 L 522.7111 267.0215 C 522.1049 267.3644 521.5339 267.6909 521 268 C 501 278 516 272 515 274 C 513 277 513 276 512 284 C 510 292 508 314 507 325 C 506 335 507 341 508 345",
          "duration": 1.78,
          "lineWidth": 12
        }
      ]
    },
    {
      "id": "leaf",
      "title": "Draw the leaf",
      "instruction": "Start at the top of the stem. Sweep out to a point, then curve back to the stem.",
      "voiceover": null,
      "strokes": [
        {
          "d": "M 541.3403 217.2992 C 545.5971 212.4605 548.7392 214.2608 556 207 C 564 199 577 182 586 174 C 596 165 605 160 613 156 C 621 152 626 150 635 147 C 644 145 648 143 666 142 C 683 141 721 143 739 143 C 758 143 771 139 777 142 C 782 144 777 149 775 157 C 773 164 769 176 765 184 C 762 192 759 197 756 204 C 752 210 749 216 742 225 C 735 233 721 247 713 254 C 705 261 702 263 695 267 C 689 271 681 275 675 278 C 669 281 665 282 657 285 C 650 287 639 290 628 292 C 618 293 604 293 596 292 C 587 292 584 291 577 290 C 570 288 561 286 551 283 C 542 279 524 272 520 267 C 519.484 266.3808 519.0745 265.7616 518.7583 265.1402",
          "duration": 3.04,
          "lineWidth": 12
        }
      ]
    },
    {
      "id": "vein",
      "title": "Add the leaf's center line",
      "instruction": "Draw one line along the middle of the leaf. Stop before the tip.",
      "voiceover": null,
      "strokes": [
        {
          "d": "M 522.7111 267.0215 C 543.6776 255.162 606.7306 223.6628 632 212 C 657 200 659 200 672 196 C 686 191 705 186 712 184",
          "duration": 0.98,
          "lineWidth": 9
        }
      ]
    },
    {
      "id": "red",
      "title": "Color the apple",
      "instruction": "Color the apple red.",
      "voiceover": null,
      "strokes": [],
      "fills": [
        {
          "d": "M 366 296 C 374 296 385 297 394 298 C 403 300 412 302 419 305 C 427 308 432 311 439 315 C 446 319 457 328 462 331 C 467 334 469 333 471 334 C 473 335 471 337 474 339 C 477 341 483 346 487 347 C 491 349 496 349 500 348 C 504 347 510 344 512 342 C 514 340 511 339 514 338 C 517 337 521 339 530 335 C 540 331 557 319 571 313 C 585 307 598 302 612 300 C 627 298 647 300 658 300 C 669 301 666 300 676 303 C 686 306 705 311 716 316 C 728 321 734 324 745 333 C 756 342 771 356 781 368 C 791 380 798 390 805 404 C 812 418 820 437 824 453 C 829 469 831 487 832 502 C 833 517 833 531 832 544 C 831 557 832 562 828 578 C 825 595 819 622 811 643 C 804 664 794 685 783 704 C 772 723 761 740 746 758 C 731 776 709 798 694 811 C 679 824 669 830 657 837 C 645 844 632 849 622 853 C 612 857 604 858 595 859 C 586 860 576 860 566 858 C 556 856 545 850 536 848 C 527 846 522 844 512 844 C 502 844 489 844 475 846 C 461 849 439 857 426 859 C 413 861 405 860 396 859 C 387 858 381 857 371 853 C 361 850 347 844 336 838 C 325 832 316 827 303 815 C 290 803 268 780 256 766 C 244 752 238 741 231 730 C 224 719 221 714 214 700 C 207 686 196 661 189 644 C 182 627 178 612 174 597 C 170 582 168 573 166 556 C 164 539 164 512 164 497 C 164 483 165 481 168 469 C 171 457 175 438 181 423 C 187 408 194 395 205 381 C 216 367 237 347 247 338 C 257 329 257 330 263 326 C 269 322 274 320 282 316 C 291 312 303 307 314 304 C 325 301 337 298 346 297 C 355 296 358 296 366 296 Z",
          "color": "#D8433B",
          "duration": 3,
          "fillRule": "evenodd"
        }
      ]
    },
    {
      "id": "green",
      "title": "Color the leaf",
      "instruction": "Color the leaf green.",
      "voiceover": null,
      "strokes": [],
      "fills": [
        {
          "d": "M 768 134 C 771 134 769 132 772 134 C 775 136 784 140 784 148 C 784 156 778 172 774 181 C 771 190 768 195 763 204 C 758 213 751 223 743 233 C 735 243 722 255 714 262 C 706 269 701 272 693 276 C 685 280 677 285 668 288 C 659 291 645 294 639 295 C 633 297 635 296 634 297 C 633 298 638 299 634 299 C 631 300 622 300 613 300 C 604 300 589 299 579 297 C 569 296 563 294 555 291 C 547 288 537 284 531 281 C 526 278 524 276 522 272 C 520 268 516 265 520 255 C 524 245 540 220 546 210 C 552 200 550 204 557 196 C 564 188 582 170 590 163 C 598 156 599 156 605 152 C 612 149 619 145 629 142 C 639 139 645 136 666 135 C 687 134 739 137 756 137 C 773 137 765 135 768 134 Z",
          "color": "#4F9D4A",
          "duration": 1.8,
          "fillRule": "evenodd"
        }
      ]
    },
    {
      "id": "brown",
      "title": "Color the stem",
      "instruction": "Color the stem brown.",
      "voiceover": null,
      "strokes": [],
      "fills": [
        {
          "d": "M 498 177 C 503 175 509 177 515 178 C 521 180 529 183 534 186 C 539 189 541 191 543 194 C 545 197 544 204 545 206 C 546 208 551 199 547 207 C 543 215 524 244 520 255 C 516 266 523 272 523 275 C 523 278 521 272 520 275 C 519 278 517 284 516 293 C 515 302 513 323 512 330 C 511 338 512 337 512 338 C 512 340 516 337 514 339 C 512 341 506 347 501 348 C 497 349 492 349 487 347 C 483 346 477 341 474 339 C 471 337 472 340 471 335 C 470 330 469 322 469 310 C 469 298 468 278 469 264 C 470 250 472 239 474 227 C 477 215 480 200 484 192 C 488 184 493 179 498 177 Z",
          "color": "#8A5A33",
          "duration": 1.2,
          "fillRule": "evenodd"
        }
      ]
    }
  ]
}
