{
  "schemaVersion": 2,
  "id": "helicopter",
  "title": "Helicopter",
  "canvas": { "width": 1000, "height": 1000 },
  "steps": [
    {
      "id": "cabin-top",
      "title": "Draw the cabin",
      "instruction": "The cabin is a big egg. Curve from the roof round the nose to the bottom.",
      "voiceover": null,
      "strokes": [
        {
          "d": "M 629 340 C 649 340 682 342 699 344 C 712 345 721 347 731 350 C 742 352 753 355 762 358 C 771 361 778 364 786 368 C 794 372 803 376 811 381 C 819 386 827 391 833 397 C 840 403 846 408 852 414 C 858 421 864 429 869 437 C 874 444 878 452 882 460 C 885 468 888 475 889 483 C 891 492 893 501 893 510 C 894 518 893 525 892 532 C 891 540 888 549 885 557 C 882 564 878 572 873 578 C 869 584 864 588 859 593 C 854 598 849 601 844 605 C 838 609 834 612 826 615 C 814 621 792 631 773 636 C 754 640 731 641 715 643 C 699 644 691 644 675 644",
          "duration": 3.2,
          "lineWidth": 11
        }
      ]
    },
    {
      "id": "cabin-bottom",
      "title": "Close the cabin",
      "instruction": "Come back over the roof and round the back to close it.",
      "voiceover": null,
      "strokes": [
        {
          "d": "M 629 340 C 609 341 594 343 579 347 C 563 350 548 355 536 360 C 523 366 514 371 504 379 C 495 387 483 398 476 408 C 469 418 466 432 463 441 C 460 447 459 451 458 458 C 456 464 455 472 454 481 C 453 489 453 499 454 508 C 454 516 455 525 456 533 C 458 542 461 551 463 559 C 466 567 469 573 473 579 C 476 586 481 592 486 597 C 490 603 496 607 502 612 C 509 617 520 625 525 628 C 527 629 529 630 532 631 C 539 633 559 637 569 639 C 579 641 584 642 595 643 C 612 644 655 644 675 644",
          "duration": 2.9,
          "lineWidth": 11
        }
      ]
    },
    {
      "id": "boom",
      "title": "Draw the tail boom",
      "instruction": "A slim tail boom reaches out behind, from high on the cabin.",
      "voiceover": null,
      "strokes": [
        {
          "d": "M 476 406 C 467 406 444 405 423 406 C 363 407 169 414 116 416 C 111 416 107 417 103 418 C 100 420 97 421 95 423 C 92 425 89 428 87 431 C 85 434 84 437 83 441 C 83 445 83 450 84 454 C 85 458 86 462 89 465 C 92 468 95 471 99 473 C 104 475 108 477 114 477 C 166 483 352 500 408 505 C 426 506 445 507 453 508",
          "duration": 4,
          "lineWidth": 11
        }
      ]
    },
    {
      "id": "window",
      "title": "Draw the window",
      "instruction": "The window is a rounded wedge in the nose. Leave a gap all around.",
      "voiceover": null,
      "strokes": [
        {
          "d": "M 705 384 C 713 384 728 386 739 389 C 751 391 762 395 773 400 C 783 405 794 411 803 419 C 813 426 823 435 830 444 C 837 452 842 460 847 469 C 851 479 856 491 858 502 C 859 512 858 525 857 531 C 857 536 855 539 853 543 C 851 546 850 548 847 550 C 843 553 839 556 833 558 C 828 560 822 562 813 563 C 801 564 772 565 758 565 C 744 566 733 565 725 564 C 717 563 712 563 706 561 C 701 560 694 558 690 556 C 685 554 682 552 679 548 C 677 545 674 541 673 535 C 671 530 669 523 669 514 C 668 494 669 431 669 412 C 670 406 672 402 673 399 C 675 395 677 393 680 390 C 683 388 687 387 691 385 C 695 384 699 383 705 384 Z",
          "duration": 3.1,
          "lineWidth": 10
        }
      ]
    },
    {
      "id": "mast",
      "title": "Draw the mast",
      "instruction": "One short upright line stands on the roof.",
      "voiceover": null,
      "strokes": [
        {
          "d": "M 629 339 L 629 279",
          "duration": 0.4,
          "lineWidth": 17
        }
      ]
    },
    {
      "id": "blade",
      "title": "Draw the blade",
      "instruction": "The blade lies across the top of it, like a wide letter T.",
      "voiceover": null,
      "strokes": [
        {
          "d": "M 334 278 L 912 278",
          "duration": 2.9,
          "lineWidth": 17
        }
      ]
    },
    {
      "id": "skid",
      "title": "Draw the skid",
      "instruction": "Below the cabin runs the skid. It curls up at the front like a ski.",
      "voiceover": null,
      "strokes": [
        {
          "d": "M 430 698 C 499 697 777 696 849 695 C 857 695 861 693 867 691 C 872 690 878 688 883 685 C 889 681 895 677 900 672 C 905 668 910 660 913 658",
          "duration": 2.5,
          "lineWidth": 15
        }
      ]
    },
    {
      "id": "struts",
      "title": "Draw the struts",
      "instruction": "Two short legs join the belly to the skid.",
      "voiceover": null,
      "strokes": [
        {
          "d": "M 525 631 C 524 632 523 636 522 640 C 519 647 509 667 506 677 C 503 684 502 693 502 697",
          "duration": 0.4,
          "lineWidth": 16
        },
        {
          "d": "M 774 638 C 774 639 774 644 776 649 C 779 656 786 672 789 680 C 791 686 791 693 792 696",
          "duration": 0.4,
          "lineWidth": 17
        }
      ]
    },
    {
      "id": "color-cabin",
      "title": "Color the cabin",
      "instruction": "Color the cabin red.",
      "voiceover": null,
      "strokes": [],
      "fills": [
        {
          "d": "M 622 332 C 626 331 634 331 637 332 C 639 332 638 335 639 336 C 657 336 679 336 694 337 C 708 338 716 340 729 343 C 742 346 759 350 772 355 C 785 360 801 368 809 372 C 815 375 819 378 823 381 C 827 384 831 386 835 390 C 842 396 857 411 864 419 C 871 427 875 432 879 440 C 884 448 888 457 891 465 C 894 474 897 481 898 491 C 900 501 900 514 900 523 C 900 532 898 539 896 546 C 894 553 892 559 889 565 C 886 571 885 575 880 580 C 874 587 864 599 853 607 C 842 615 826 623 814 628 C 802 633 793 634 783 637 C 783 638 783 640 782 641 C 779 642 771 645 767 645 C 764 645 762 643 759 643 C 751 644 731 648 718 649 C 705 650 695 651 679 651 C 660 651 625 651 606 650 C 591 649 580 648 568 646 C 556 644 546 639 535 636 C 534 637 533 638 531 638 C 528 637 522 634 519 632 C 517 631 518 628 516 627 C 513 625 506 624 500 619 C 493 613 481 602 474 593 C 467 584 462 573 458 563 C 454 553 451 541 450 533 C 449 527 451 520 450 517 C 450 516 448 516 447 515 C 447 514 446 513 447 512 C 448 510 453 505 454 500 C 455 494 453 487 454 478 C 455 469 459 453 461 444 C 463 437 466 431 468 426 C 471 421 475 417 476 413 C 477 409 475 404 475 400 C 485 390 496 377 505 370 C 513 363 518 361 527 357 C 537 353 553 347 563 344 C 573 341 580 340 588 339 C 597 338 608 338 614 337 C 618 336 618 333 622 332 Z M 694 384 C 692 384 690 384 688 385 C 685 387 679 389 676 393 C 673 397 669 403 669 411 C 668 432 669 498 669 519 C 669 526 671 530 672 535 C 674 540 675 544 678 548 C 681 552 685 555 689 557 C 693 559 696 560 701 561 C 710 563 725 566 742 566 C 760 567 795 565 809 564 C 816 564 821 563 827 561 C 833 559 842 555 847 552 C 851 549 853 545 855 542 C 857 539 857 537 858 533 C 859 530 860 526 860 521 C 860 515 859 505 858 498 C 857 491 855 487 853 481 C 851 475 848 469 844 462 C 840 455 834 447 827 439 C 820 431 811 422 800 415 C 789 408 774 400 761 395 C 748 390 734 387 723 385 C 712 383 700 384 694 384 Z",
          "color": "#D8433B",
          "duration": 2.6,
          "fillRule": "evenodd"
        }
      ]
    },
    {
      "id": "color-boom",
      "title": "Color the tail boom",
      "instruction": "Color the tail boom orange.",
      "voiceover": null,
      "strokes": [],
      "fills": [
        {
          "d": "M 454 399 C 461 399 469 399 472 399 C 474 399 475 400 475 402 C 476 404 477 409 476 413 C 475 417 471 421 468 426 C 466 431 463 437 461 444 C 459 453 455 469 454 478 C 453 487 455 494 454 500 C 453 506 449 509 447 514 C 336 504 172 490 113 484 C 105 483 100 481 94 478 C 89 475 83 468 80 464 C 77 460 77 456 76 452 C 75 448 75 443 76 439 C 77 435 77 432 80 429 C 83 425 89 418 94 415 C 99 412 103 410 110 410 C 170 407 394 401 454 399 Z",
          "color": "#F08A2C",
          "duration": 1.8,
          "fillRule": "evenodd"
        }
      ]
    },
    {
      "id": "color-window",
      "title": "Color the window",
      "instruction": "The window is blue.",
      "voiceover": null,
      "strokes": [],
      "fills": [
        {
          "d": "M 694 384 C 701 384 712 383 723 385 C 734 387 749 391 761 395 C 773 399 783 404 794 411 C 805 418 819 431 827 439 C 835 447 840 455 844 462 C 848 469 851 475 853 481 C 855 487 857 493 858 498 C 859 503 860 506 860 511 C 860 517 859 528 858 533 C 857 537 857 539 855 542 C 853 545 851 549 847 552 C 842 555 833 559 827 561 C 821 563 816 564 809 564 C 795 565 760 567 742 566 C 725 566 710 563 701 561 C 696 560 693 559 689 557 C 685 555 681 552 678 548 C 675 544 674 540 672 535 C 671 530 669 526 669 519 C 669 498 668 432 669 411 C 669 403 674 397 676 393 C 678 390 679 389 682 388 C 685 387 689 384 694 384 Z",
          "color": "#5B8FC7",
          "duration": 1.7,
          "fillRule": "evenodd"
        }
      ]
    }
  ]
}
