{
  "schemaVersion": 2,
  "id": "pear",
  "title": "Pear",
  "canvas": { "width": 1000, "height": 1000 },
  "steps": [
    {
      "id": "left-side",
      "title": "Draw the left side",
      "instruction": "Start at the top. Curve down and out, wide at the bottom.",
      "voiceover": null,
      "strokes": [
        {
          "d": "M 497.0043 289.9243 C 489.0401 289.5594 478.181 288 472 288 C 464 288 460 289 454 291 C 447 294 438 299 432 304 C 425 310 420 316 415 325 C 410 333 408 333 402 353 C 397 373 387 423 382 445 C 376 467 374 473 368 486 C 363 499 362 504 350 525 C 337 545 307 588 295 607 C 284 625 283 626 278 637 C 273 647 269 658 265 671 C 262 684 259 699 258 714 C 257 728 257 742 258 756 C 260 769 264 786 267 795 C 269 805 271 808 274 813 C 276 819 277 822 283 831 C 289 839 299 855 308 865 C 318 875 331 885 339 892 C 348 899 354 902 361 906 C 368 909 369 910 379 914 C 389 918 407 925 422 929 C 437 932 454 935 471 936 C 479.112 936.507 487.9951 936.757 496.9978 936.7499",
          "duration": 1.99,
          "lineWidth": 10
        }
      ]
    },
    {
      "id": "right-side",
      "title": "Draw the right side",
      "instruction": "Go back to the top. Mirror that curve down the other side.",
      "voiceover": null,
      "strokes": [
        {
          "d": "M 497.0043 289.9243 C 498.0596 289.9726 499.064 290 500 290 C 509 290 515 287 522 287 C 529 287 536 288 543 291 C 550 293 557 297 563 301 C 569 305 574 309 579 315 C 583 320 586 326 590 333 C 593 340 593 335 599 357 C 604 378 616 437 622 460 C 628 482 629 482 635 494 C 640 505 641 510 653 529 C 665 549 696 594 708 612 C 719 630 718 630 721 638 C 725 646 728 652 730 660 C 733 667 736 675 737 684 C 739 692 741 697 741 709 C 742 720 742 744 742 754 C 741 765 740 767 739 773 C 738 780 737 785 733 795 C 729 805 722 822 715 834 C 708 846 700 857 690 867 C 680 877 668 887 656 895 C 643 904 629 911 616 916 C 602 922 588 927 573 930 C 557 933 541 935 523 936 C 514.619 936.493 505.7519 936.743 496.9978 936.7499",
          "duration": 2.01,
          "lineWidth": 10
        }
      ]
    },
    {
      "id": "stem",
      "title": "Draw the stem",
      "instruction": "Start in the dip. Go up and left, over the top, back down.",
      "voiceover": null,
      "strokes": [
        {
          "d": "M 479 288 C 478 284 478 273 476 264 C 475 255 474 251 469 234 C 463 216 446 173 442 160 C 438 147 442 156 443 154 C 443 152 443 151 446 149 C 449 147 456 144 460 143 C 463 142 466 142 469 143 C 472 144 472 141 476 148 C 480 155 488 170 493 187 C 499 205 506 236 509 253 C 513 269 514 281 515 287",
          "duration": 1.6,
          "lineWidth": 10
        }
      ]
    },
    {
      "id": "leaf",
      "title": "Draw the leaf",
      "instruction": "Start high on the stem. Sweep out to a point, then curve back.",
      "voiceover": null,
      "strokes": [
        {
          "d": "M 503 185 C 504 188 505 190 507 192 C 508 194 511 196 513 198 C 515 199 515 199 520 200 C 524 200 533 200 539 199 C 546 199 552 198 561 196 C 570 194 583 191 593 186 C 603 181 613 175 621 169 C 629 163 634 157 641 149 C 648 140 655 130 661 119 C 666 107 673 91 676 80 C 680 69 689 56 682 54 C 674 51 645 60 632 63 C 618 66 612 68 603 71 C 594 74 587 77 578 82 C 570 86 562 91 554 97 C 546 104 539 111 533 120 C 526 128 520 139 515 148 C 510 158 505 173 503 179 C 501 185 503 183 503 185",
          "duration": 2.5,
          "lineWidth": 9
        }
      ]
    },
    {
      "id": "vein",
      "title": "Add the leaf's center line",
      "instruction": "Draw one line along the middle of the leaf. Stop before the tip.",
      "voiceover": null,
      "strokes": [
        {
          "d": "M 510 195 C 512 192 505 195 523 181 C 541 166 602 119 618 107",
          "duration": 0.7,
          "lineWidth": 7
        }
      ]
    },
    {
      "id": "pear-green",
      "title": "Color the pear",
      "instruction": "Color the pear light green.",
      "voiceover": null,
      "strokes": [],
      "fills": [
        {
          "d": "M 471 282 C 477 282 481 288 485 289 C 489 291 492 291 496 291 C 500 291 504 292 508 291 C 512 290 517 286 519 284 C 521 283 515 282 519 282 C 523 282 536 282 544 285 C 553 288 563 293 570 298 C 577 303 583 309 588 317 C 593 325 596 322 602 346 C 609 370 621 434 627 459 C 633 484 634 480 640 494 C 647 508 655 523 666 541 C 678 559 698 585 709 602 C 720 619 725 630 730 642 C 736 655 739 665 742 677 C 745 689 747 699 748 712 C 749 725 749 740 748 754 C 747 768 744 781 740 794 C 736 807 731 819 724 831 C 717 844 707 857 696 869 C 685 881 671 892 658 901 C 646 910 635 915 621 921 C 608 927 592 932 577 935 C 562 939 551 941 532 942 C 514 943 485 943 466 942 C 447 941 434 938 418 934 C 402 930 382 923 368 916 C 354 910 344 903 333 895 C 322 887 312 878 302 867 C 292 856 281 840 274 827 C 267 814 263 802 259 790 C 255 778 253 768 252 753 C 251 738 253 712 254 699 C 255 686 257 681 259 673 C 261 665 263 658 267 649 C 271 640 269 639 281 619 C 293 599 328 551 341 530 C 354 509 355 506 360 494 C 366 482 368 479 374 456 C 380 434 390 380 395 359 C 400 338 401 338 405 330 C 409 322 414 315 418 309 C 422 304 426 301 431 297 C 436 294 440 291 447 288 C 454 286 465 282 471 282 Z",
          "color": "#C3E268",
          "duration": 3,
          "fillRule": "evenodd"
        }
      ]
    },
    {
      "id": "leaf-green",
      "title": "Color the leaf",
      "instruction": "Color the leaf green.",
      "voiceover": null,
      "strokes": [],
      "fills": [
        {
          "d": "M 678 48 C 691 45 679 47 681 48 C 683 49 687 53 688 55 C 689 57 691 50 688 59 C 685 68 677 97 671 111 C 665 125 659 135 651 145 C 644 155 635 164 626 172 C 617 180 607 186 596 191 C 585 196 574 200 562 202 C 550 205 533 205 524 206 C 515 207 513 207 510 206 C 507 205 506 205 504 202 C 502 200 498 195 497 191 C 496 188 496 183 496 181 C 496 179 496 185 498 181 C 500 177 501 166 506 155 C 511 144 521 126 528 116 C 535 106 541 101 549 94 C 557 88 566 82 575 77 C 584 72 586 70 603 65 C 620 60 665 51 678 48 Z",
          "color": "#4F9D4A",
          "duration": 1.5,
          "fillRule": "evenodd"
        }
      ]
    },
    {
      "id": "stem-brown",
      "title": "Color the stem",
      "instruction": "Color the stem brown.",
      "voiceover": null,
      "strokes": [],
      "fills": [
        {
          "d": "M 459 136 C 463 135 465 135 469 136 C 473 137 476 136 481 143 C 486 150 494 172 497 180 C 500 188 496 187 497 191 C 498 195 502 200 504 202 C 506 204 508 203 508 204 C 508 205 503 199 504 208 C 505 217 514 245 516 257 C 518 269 517 277 518 281 C 519 285 520 281 520 281 C 520 282 521 282 519 284 C 517 286 513 290 508 291 C 503 292 495 291 489 290 C 483 289 477 288 474 283 C 471 278 473 270 471 261 C 469 252 466 239 462 227 C 458 215 453 198 448 187 C 444 176 436 167 435 160 C 434 153 438 149 440 146 C 442 143 445 142 448 140 C 451 138 456 137 459 136 Z",
          "color": "#8A5A33",
          "duration": 1.2,
          "fillRule": "evenodd"
        }
      ]
    }
  ]
}
