{
  "schemaVersion": 2,
  "id": "cylinder",
  "title": "Cylinder",
  "canvas": { "width": 1000, "height": 1000 },
  "steps": [
    {
      "id": "top-back",
      "title": "Draw the top",
      "instruction": "A circle seen from the side looks like a flat oval. Draw its back, from the left end over to the right.",
      "voiceover": null,
      "strokes": [
        {
          "d": "M 239 158 C 240 153 240 151 241 147 C 243 143 246 138 250 133 C 254 129 259 125 265 122 C 273 117 283 112 294 108 C 304 104 314 101 326 98 C 338 94 352 91 367 88 C 383 85 405 82 422 80 C 438 78 452 77 467 77 C 481 76 492 76 507 77 C 521 77 535 76 554 77 C 572 78 599 82 618 85 C 638 88 654 91 671 95 C 687 100 704 106 715 111 C 726 115 733 119 740 124 C 747 129 753 135 756 141 C 760 146 760 150 761 157",
          "duration": 2.9,
          "lineWidth": 12
        }
      ]
    },
    {
      "id": "top-front",
      "title": "Close the top",
      "instruction": "Come back along the front to close the oval.",
      "voiceover": null,
      "strokes": [
        {
          "d": "M 760 176 C 754 178 738 188 729 192 C 721 197 717 199 708 202 C 694 206 671 214 649 219 C 626 224 601 228 576 230 C 550 232 522 233 497 232 C 471 232 445 232 421 230 C 396 227 370 223 349 219 C 329 215 308 208 295 203 C 287 200 281 198 274 194 C 267 190 258 183 252 180 C 248 178 242 176 241 176",
          "duration": 2.7,
          "lineWidth": 12
        }
      ]
    },
    {
      "id": "sides",
      "title": "Draw the sides",
      "instruction": "Draw a straight side down from each end of the oval. Make them match.",
      "voiceover": null,
      "strokes": [
        {
          "d": "M 239 158 C 239 165 239 180 239 195 C 238 304 238 707 239 813",
          "duration": 3.3,
          "lineWidth": 12
        },
        {
          "d": "M 761 157 C 762 165 761 178 761 192 C 762 300 762 701 761 808",
          "duration": 3.3,
          "lineWidth": 12
        }
      ]
    },
    {
      "id": "bottom",
      "title": "Draw the bottom",
      "instruction": "Join the sides with a sagging curve. It copies the front of the oval.",
      "voiceover": null,
      "strokes": [
        {
          "d": "M 239 813 C 239 822 239 828 242 835 C 245 842 249 849 255 855 C 262 861 269 867 279 872 C 289 878 304 884 316 889 C 327 894 337 897 351 900 C 364 904 379 908 398 911 C 416 913 440 916 461 917 C 481 919 502 919 520 918 C 537 918 554 916 568 915 C 583 914 592 912 604 910 C 615 908 623 907 635 904 C 648 900 664 896 676 892 C 688 887 700 883 709 878 C 718 874 725 870 732 865 C 739 860 745 854 750 849 C 754 843 757 840 759 834 C 760 827 761 819 761 808",
          "duration": 3.1,
          "lineWidth": 12
        }
      ]
    },
    {
      "id": "body-color",
      "title": "Color the body",
      "instruction": "Color the body orange.",
      "voiceover": null,
      "strokes": [],
      "fills": [
        {
          "d": "M 241 175 C 243 174 246 174 248 175 C 251 177 255 183 260 186 C 265 190 269 193 276 196 C 288 201 309 210 329 215 C 349 220 375 225 396 228 C 417 231 431 232 454 233 C 478 234 509 234 537 233 C 565 232 603 228 623 225 C 637 223 645 221 658 218 C 671 215 687 211 700 206 C 713 201 728 194 737 189 C 744 185 749 177 753 175 C 755 174 758 174 760 175 C 763 176 765 180 768 183 C 768 398 769 718 768 828 C 768 835 766 839 762 844 C 756 852 741 866 732 873 C 723 880 716 883 707 887 C 698 891 691 895 680 898 C 666 903 645 910 621 914 C 597 919 564 923 536 925 C 508 927 480 926 453 924 C 426 922 389 916 372 913 C 363 911 356 907 351 906 C 348 905 347 907 344 906 C 336 904 311 895 301 891 C 293 888 288 886 282 882 C 276 879 270 876 264 870 C 257 864 243 850 238 843 C 235 839 233 836 233 830 C 232 720 233 399 233 183 C 236 180 239 176 241 175 Z",
          "color": "#F08A2C",
          "duration": 3,
          "fillRule": "evenodd"
        }
      ]
    },
    {
      "id": "top-color",
      "title": "Color the top",
      "instruction": "Color the top yellow.",
      "voiceover": null,
      "strokes": [],
      "fills": [
        {
          "d": "M 475 70 C 494 70 521 69 540 70 C 559 71 572 72 590 74 C 609 76 634 80 651 84 C 669 88 680 91 695 96 C 710 101 729 109 740 116 C 751 123 759 134 764 140 C 767 144 767 147 768 151 C 769 155 769 161 768 165 C 767 169 763 173 760 175 C 757 177 754 175 751 176 C 748 178 747 181 744 184 C 741 187 736 190 730 193 C 719 198 698 207 678 213 C 658 219 633 224 609 227 C 586 230 566 232 537 233 C 506 234 455 233 423 231 C 392 229 363 222 345 219 C 333 217 327 215 315 211 C 304 207 285 200 276 196 C 271 194 268 192 264 189 C 259 186 252 177 248 175 C 246 174 243 177 241 175 C 239 173 234 169 233 165 C 232 161 232 155 233 151 C 234 147 234 143 237 139 C 241 134 249 124 258 118 C 267 112 278 107 289 103 C 300 99 309 95 322 92 C 339 88 371 81 388 78 C 402 75 410 74 424 73 C 439 72 456 71 475 70 Z",
          "color": "#F7CF46",
          "duration": 2.3,
          "fillRule": "evenodd"
        }
      ]
    }
  ]
}
