{
  "schemaVersion": 2,
  "id": "hot-air-balloon",
  "title": "Hot Air Balloon",
  "canvas": { "width": 1000, "height": 1000 },
  "steps": [
    {
      "id": "balloon-left",
      "title": "Draw the left side",
      "instruction": "The balloon is one big teardrop. Set off at the top and curve down its left side.",
      "voiceover": null,
      "strokes": [
        {
          "d": "M 508.3997 78.7363 C 506.291 78.7506 504.1593 78.8339 502 79 C 490 79 478 79 464 82 C 449 84 430 88 415 93 C 399 98 381 106 370 112 C 361 116 355 120 348 125 C 342 130 336 133 329 139 C 321 147 306 161 296 173 C 287 185 279 197 272 211 C 265 225 259 241 254 257 C 249 274 246 297 244 312 C 243 325 243 336 244 347 C 244 357 245 364 247 374 C 249 385 252 399 255 411 C 258 422 262 433 266 442 C 270 452 272 458 277 467 C 282 477 287 487 295 500 C 311 524 354 584 372 613 C 386 635 398 658 404 671 C 406.8384 675.2576 408.1662 678.5081 409.4126 682.8954",
          "duration": 4,
          "lineWidth": 10
        }
      ]
    },
    {
      "id": "balloon-right",
      "title": "Draw the right side",
      "instruction": "Return to the top and send the same curve down the right.",
      "voiceover": null,
      "strokes": [
        {
          "d": "M 508.3997 78.7363 C 518.9864 78.6644 528.9932 80.3322 539 82 C 552 84 566 88 577 90 C 587 93 593 95 603 99 C 613 104 628 110 640 118 C 653 126 667 136 679 146 C 690 157 700 169 709 181 C 717 193 725 205 731 218 C 737 232 743 246 747 261 C 751 275 753 291 755 306 C 756 320 756 334 755 345 C 755 356 755 362 753 372 C 752 381 750 392 747 403 C 744 414 740 426 736 436 C 732 447 728 455 724 465 C 719 475 715 484 707 496 C 691 521 643 588 624 618 C 609 641 599 663 592 679 C 591.4966 680.1746 591.0354 681.307 590.6112 682.4054",
          "duration": 3.9,
          "lineWidth": 10
        }
      ]
    },
    {
      "id": "mouth",
      "title": "Close the bottom",
      "instruction": "A straight line across the bottom closes the balloon. That opening is the mouth.",
      "voiceover": null,
      "strokes": [
        {
          "d": "M 411 682 L 590 682",
          "duration": 0.9,
          "lineWidth": 11
        }
      ]
    },
    {
      "id": "stripes",
      "title": "Draw the stripes",
      "instruction": "Two long curves split the bag into three stripes, top to bottom.",
      "voiceover": null,
      "strokes": [
        {
          "d": "M 446 88 C 445 89 444 95 441 99 C 438 105 432 115 428 123 C 424 131 421 138 418 148 C 413 162 404 188 400 207 C 395 225 393 237 390 259 C 388 280 386 311 387 336 C 387 360 389 385 391 408 C 394 432 397 454 401 476 C 405 497 408 513 414 537 C 422 572 443 657 449 681",
          "duration": 3,
          "lineWidth": 10
        },
        {
          "d": "M 556 88 C 556 90 557 95 559 100 C 562 107 570 121 575 131 C 579 140 582 147 586 158 C 591 172 599 196 603 218 C 607 239 610 265 612 288 C 614 310 613 333 612 353 C 612 372 611 385 608 406 C 606 426 603 452 599 476 C 594 499 590 519 583 548 C 576 579 560 639 554 661 C 553 669 552 678 552 682",
          "duration": 3,
          "lineWidth": 10
        }
      ]
    },
    {
      "id": "skirt",
      "title": "Draw the skirt",
      "instruction": "Under the mouth, two short lines lean in toward the basket.",
      "voiceover": null,
      "strokes": [
        {
          "d": "M 409.4126 682.8954 C 409.9227 684.6909 410.4192 686.6768 411 689 C 415 710 428 780 432 799",
          "duration": 0.6,
          "lineWidth": 10
        },
        {
          "d": "M 590.6112 682.4054 C 585.9789 694.3987 585.7483 702.3424 583 717 C 579 736 570 785 568 799",
          "duration": 0.6,
          "lineWidth": 10
        }
      ]
    },
    {
      "id": "basket",
      "title": "Draw the basket",
      "instruction": "The basket is a little tub. Draw all four sides in one go.",
      "voiceover": null,
      "strokes": [
        {
          "d": "M 434 799 C 461 799 532 800 581 801 C 580 807 580 811 579 819 C 577 834 570 877 567 893 C 565 903 563 909 561 918 C 525 917 473 918 453 917 C 446 917 443 916 438 916 C 432 877 426 839 420 801 C 424 800 428 799 434 799 Z",
          "duration": 2.6,
          "lineWidth": 10
        }
      ]
    },
    {
      "id": "color-sides",
      "title": "Color the outer stripes",
      "instruction": "Color the outer stripes red.",
      "voiceover": null,
      "strokes": [],
      "fills": [
        {
          "d": "M 441 80 C 443 81 445 82 446 84 C 447 87 448 91 446 95 C 444 100 438 105 434 112 C 429 121 423 133 417 148 C 411 163 404 187 400 204 C 396 222 393 237 391 253 C 389 269 388 282 387 301 C 387 320 386 341 388 368 C 390 395 395 433 399 462 C 404 491 407 511 415 543 C 423 578 443 647 448 670 C 449 675 449 681 448 684 C 448 686 447 687 445 687 C 440 688 421 686 416 687 C 414 687 417 690 416 691 C 415 692 413 692 412 691 C 410 690 406 686 403 682 C 400 677 400 670 396 663 C 391 653 382 636 371 619 C 354 594 312 537 295 511 C 283 492 275 477 268 462 C 261 447 256 433 252 420 C 248 407 245 395 243 384 C 241 374 240 368 239 357 C 238 344 238 322 239 307 C 240 293 242 282 245 270 C 248 258 251 248 255 236 C 260 224 265 211 272 199 C 279 187 286 176 296 164 C 306 153 320 139 331 130 C 342 121 350 116 361 110 C 373 104 387 97 400 92 C 413 87 427 84 441 80 Z M 559 80 C 572 84 584 86 597 91 C 610 96 622 101 635 108 C 648 115 665 127 675 135 C 685 142 689 147 697 156 C 705 165 714 177 722 189 C 730 201 737 216 743 230 C 749 244 753 258 756 272 C 759 286 761 301 762 314 C 763 327 763 338 762 350 C 761 362 759 376 757 387 C 755 398 753 406 749 418 C 745 431 738 449 731 465 C 724 481 717 494 705 512 C 689 537 649 591 632 615 C 621 632 612 648 606 659 C 601 668 599 678 596 683 C 594 687 590 690 588 691 C 587 692 585 692 584 691 C 583 690 584 688 584 687 C 574 687 564 687 554 687 C 553 686 552 686 552 685 C 552 682 551 676 552 671 C 558 645 581 563 589 527 C 596 498 599 481 603 455 C 607 429 611 397 613 369 C 615 341 614 306 613 285 C 612 267 611 257 608 241 C 605 225 602 207 597 189 C 592 171 585 151 578 135 C 571 119 559 104 555 95 C 553 91 554 87 555 84 C 556 82 558 81 559 80 Z",
          "color": "#D8433B",
          "duration": 3,
          "fillRule": "evenodd"
        }
      ]
    },
    {
      "id": "color-middle",
      "title": "Color the middle stripe",
      "instruction": "The middle stripe is yellow.",
      "voiceover": null,
      "strokes": [],
      "fills": [
        {
          "d": "M 487 73 C 498 72 509 73 518 73 C 527 74 537 75 542 76 C 544 76 545 76 547 77 C 549 79 554 82 555 85 C 556 88 553 91 555 95 C 559 103 572 122 578 135 C 584 148 588 158 592 172 C 596 186 601 203 604 218 C 607 233 609 246 611 263 C 613 280 614 300 614 318 C 614 336 615 349 613 369 C 611 392 607 429 603 455 C 599 481 596 498 589 527 C 581 562 559 640 553 666 C 551 673 553 681 552 684 C 552 686 550 686 549 687 C 516 687 484 687 451 687 C 450 686 448 686 448 684 C 448 681 449 675 448 670 C 443 647 422 573 415 543 C 410 522 408 512 404 491 C 400 466 393 418 390 394 C 388 376 387 368 387 350 C 387 330 387 294 389 271 C 391 248 395 230 398 213 C 402 196 405 183 410 168 C 415 153 421 137 427 125 C 433 113 443 102 446 95 C 448 91 445 88 446 85 C 448 82 450 78 455 77 C 462 75 477 74 487 73 Z",
          "color": "#F7CF46",
          "duration": 2.8,
          "fillRule": "evenodd"
        }
      ]
    },
    {
      "id": "color-basket",
      "title": "Color the basket",
      "instruction": "Color the basket brown.",
      "voiceover": null,
      "strokes": [],
      "fills": [
        {
          "d": "M 426 790 C 428 789 435 789 437 790 C 439 791 439 793 440 794 C 481 794 521 794 562 794 C 562 793 561 791 563 790 C 565 789 572 789 574 790 C 576 791 573 793 574 794 C 575 795 578 794 580 795 C 582 796 586 800 587 802 C 588 804 587 806 587 808 C 584 827 574 881 568 917 C 566 919 564 921 562 923 C 521 923 480 923 439 923 C 437 921 433 918 432 916 C 431 915 431 914 431 912 C 428 894 417 829 414 810 C 413 806 413 804 414 801 C 415 798 419 795 421 794 C 422 793 424 795 425 794 C 426 793 424 791 426 790 Z",
          "color": "#8A5A33",
          "duration": 1.5,
          "fillRule": "evenodd"
        }
      ]
    }
  ]
}
