{
  "schemaVersion": 2,
  "id": "cupcake",
  "title": "Cupcake",
  "canvas": { "width": 1000, "height": 1000 },
  "steps": [
    {
      "id": "wrapper",
      "title": "Draw the wrapper",
      "instruction": "The wrapper is a cup with slanted sides. Go down the left, along the bottom, and up the right.",
      "voiceover": null,
      "strokes": [
        {
          "d": "M 279 522 C 279 524 278 529 279 534 C 290 584 331 776 343 826 C 345 832 348 835 351 838 C 355 840 358 843 363 844 C 373 845 391 845 411 846 C 454 846 585 846 622 845 C 628 845 632 844 636 843 C 640 841 644 838 647 835 C 649 832 651 830 652 827 C 654 824 655 820 656 815 C 667 765 709 570 720 522",
          "duration": 4,
          "lineWidth": 5
        }
      ]
    },
    {
      "id": "folds",
      "title": "Draw the folds",
      "instruction": "Wrappers have folds. Draw four lines down it, fanning out a little.",
      "voiceover": null,
      "strokes": [
        {
          "d": "M 346 563 L 388 813",
          "duration": 1.3,
          "lineWidth": 6
        },
        {
          "d": "M 445 565 L 459 814",
          "duration": 1.2,
          "lineWidth": 5
        },
        {
          "d": "M 554 565 C 553 571 551 588 550 605 C 547 646 540 780 539 815",
          "duration": 1.3,
          "lineWidth": 7
        },
        {
          "d": "M 652 562 L 610 812",
          "duration": 1.3,
          "lineWidth": 6
        }
      ]
    },
    {
      "id": "bottom-tier",
      "title": "Draw the bottom layer",
      "instruction": "Now the frosting, in three puffy layers. The widest sits on the wrapper like a cushion.",
      "voiceover": null,
      "strokes": [
        {
          "d": "M 310 386 C 306 387 297 389 291 392 C 286 395 282 398 277 402 C 271 407 265 413 261 419 C 257 424 254 429 251 435 C 248 441 246 448 245 455 C 244 461 243 468 244 473 C 244 479 245 484 247 489 C 249 495 253 500 256 504 C 259 508 262 511 266 513 C 269 516 272 518 277 520 C 285 522 300 527 316 530 C 332 533 352 535 373 537 C 393 539 414 540 442 540 C 473 541 532 541 563 540 C 587 540 603 539 624 537 C 646 535 674 531 689 528 C 700 526 709 524 715 522 C 721 520 724 519 728 516 C 733 513 738 509 742 504 C 746 500 749 494 751 488 C 753 482 754 475 754 468 C 754 462 753 455 751 449 C 749 443 746 436 743 430 C 739 425 736 420 731 415 C 726 410 721 406 714 402 C 708 398 696 393 693 392",
          "duration": 4,
          "lineWidth": 5
        }
      ]
    },
    {
      "id": "middle-tier",
      "title": "Draw the middle layer",
      "instruction": "Stack a smaller puff on top of it.",
      "voiceover": null,
      "strokes": [
        {
          "d": "M 368 280 C 359 279 348 287 340 292 C 333 297 328 301 323 308 C 318 315 312 324 309 332 C 306 340 304 347 304 356 C 304 364 307 374 309 380 C 311 386 314 389 319 393 C 324 398 332 405 340 409 C 348 414 356 417 367 420 C 378 423 393 426 409 429 C 426 431 444 433 465 434 C 485 435 515 435 535 434 C 554 434 567 432 583 430 C 599 428 618 425 630 422 C 642 419 651 415 659 412 C 664 410 668 408 672 405 C 677 401 684 396 688 393 C 690 391 691 390 692 388 C 694 385 695 382 696 379 C 697 376 698 371 698 367 C 698 364 698 359 697 356 C 697 352 696 348 694 344 C 693 340 692 336 688 331 C 684 326 676 316 670 311 C 663 305 653 301 647 299 C 644.5696 297.7848 642.8776 297.308 641.0266 297.3452",
          "duration": 2.79,
          "lineWidth": 5
        },
        {
          "d": "M 641.0266 297.3452 C 639.8312 297.3692 638.5696 297.6076 637 298 C 631 300 621 307 610 310 C 600 313 586 317 574 319 C 563 321 556 322 544 322 C 530 323 511 324 496 323 C 480 322 465 321 452 318 C 438 316 423 313 413 309 C 403 306 396 302 389 297 C 381 292 376 280 368 280",
          "duration": 1.21,
          "lineWidth": 5
        }
      ]
    },
    {
      "id": "top-tier",
      "title": "Draw the top layer",
      "instruction": "The last puff is the smallest. Sweep it up to a soft point, like a little wave.",
      "voiceover": null,
      "strokes": [
        {
          "d": "M 368 280 C 367 276 366 263 367 256 C 367 249 369 244 372 238 C 375 231 379 223 384 217 C 389 210 397 204 403 199 C 409 195 413 192 420 189 C 426 185 433 182 442 179 C 458 175 496 167 513 162 C 526 158 534 155 544 151 C 554 146 564 141 572 134 C 579 128 587 117 591 112 C 594 109 598 107 601 107 C 603 106 605 106 607 109 C 609 112 613 121 615 127 C 617 132 618 136 619 142 C 620 147 621 153 621 161 C 621 170 621 181 618 192 C 615 203 603 219 605 228 C 606 236 619 236 625 241 C 631 246 635 252 638 258 C 641 263 643 268 643 274 C 644 281 641 292 641 296",
          "duration": 2.7,
          "lineWidth": 6
        }
      ]
    },
    {
      "id": "frosting-color",
      "title": "Color the frosting",
      "instruction": "Color the frosting pink.",
      "voiceover": null,
      "strokes": [],
      "fills": [
        {
          "d": "M 596 104 C 599 103 601 103 604 104 C 607 105 610 107 612 110 C 615 115 619 124 621 131 C 623 138 625 144 625 153 C 625 163 625 178 623 188 C 622 198 619 205 616 211 C 614 217 606 221 608 225 C 610 229 621 232 627 237 C 633 242 640 251 643 257 C 646 263 647 268 648 273 C 649 278 648 283 647 286 C 646 289 641 290 643 292 C 647 295 662 300 670 306 C 678 312 686 322 691 328 C 695 333 696 337 698 342 C 700 347 702 351 702 357 C 703 363 702 373 701 378 C 700 382 697 384 696 386 C 695 387 695 389 696 390 C 699 392 710 395 715 398 C 720 401 723 403 728 407 C 733 411 739 418 743 423 C 747 429 750 435 752 440 C 754 445 756 449 757 455 C 758 461 759 468 758 474 C 758 480 756 487 754 492 C 752 497 749 502 746 506 C 743 510 741 513 737 515 C 733 518 726 520 724 521 C 723 522 724 524 723 524 C 721 524 717 521 713 522 C 707 523 699 527 689 529 C 674 532 649 536 622 538 C 594 540 555 542 523 542 C 491 543 456 542 430 541 C 404 540 385 539 366 537 C 347 535 327 532 314 530 C 304 528 296 524 289 523 C 283 522 278 526 275 525 C 273 525 275 521 274 520 C 273 519 271 521 269 520 C 267 519 264 518 262 516 C 259 513 251 505 248 500 C 245 495 243 491 242 485 C 241 478 240 467 240 459 C 241 452 243 447 245 440 C 248 434 250 427 255 420 C 260 413 269 403 275 398 C 281 393 286 391 291 388 C 296 386 304 385 306 383 C 308 381 307 379 306 376 C 305 373 302 370 301 366 C 300 361 300 351 301 345 C 302 339 303 336 305 331 C 307 326 311 318 315 312 C 320 306 327 298 332 293 C 337 289 341 287 345 285 C 349 283 352 284 355 283 C 358 282 363 282 364 278 C 365 273 363 258 363 252 C 363 249 364 247 365 244 C 367 240 369 233 372 228 C 375 223 378 218 382 213 C 387 208 392 202 399 197 C 406 192 417 186 425 182 C 433 178 437 176 446 174 C 461 170 497 164 514 159 C 529 155 541 149 550 145 C 558 141 564 137 569 133 C 575 129 580 123 583 119 C 586 116 586 113 588 110 C 590 108 593 105 596 104 Z",
          "color": "#EE5A6A",
          "duration": 3,
          "fillRule": "evenodd"
        }
      ]
    },
    {
      "id": "wrapper-color",
      "title": "Color the wrapper",
      "instruction": "Color the wrapper blue.",
      "voiceover": null,
      "strokes": [],
      "fills": [
        {
          "d": "M 713 522 C 717 521 720 522 722 523 C 724 524 723 526 723 528 C 712 578 670 773 658 824 C 657 828 656 830 654 833 C 652 836 650 839 646 842 C 642 845 638 849 632 849 C 585 850 411 850 364 849 C 358 849 354 845 351 843 C 348 841 347 839 345 837 C 343 835 341 833 340 829 C 339 825 337 820 336 814 C 325 763 283 573 275 525 C 274 520 286 526 287 526 C 288 526 282 525 282 524 C 282 524 286 522 289 523 C 297 525 315 530 332 533 C 349 536 367 538 391 539 C 423 541 483 542 523 542 C 563 542 604 539 632 537 C 655 535 676 532 689 529 C 699 527 708 523 713 522 Z",
          "color": "#1795F5",
          "duration": 2.9,
          "fillRule": "evenodd"
        }
      ]
    }
  ]
}
